[
  {
    "id": 90,
    "name": "berry_cluster",
    "display_name": "Berry Cluster",
    "max_stack": 64,
    "edible": 4
  },
  {
    "id": 93,
    "name": "mushroom",
    "display_name": "Mushroom",
    "max_stack": 64,
    "places_block": "mushroom_block",
    "edible": 2
  },
  {
    "id": 91,
    "name": "mushroom_stew",
    "display_name": "Mushroom Stew",
    "max_stack": 4,
    "edible": 10
  },
  {
    "id": 92,
    "name": "honey_cake",
    "display_name": "Honey Cake",
    "max_stack": 4,
    "edible": 14
  }
]
