[
  { "id": 1, "name": "dirt", "display_name": "Dirt", "max_stack": 64, "places_block": "dirt" },
  { "id": 2, "name": "grass_block", "display_name": "Grass Block", "max_stack": 64, "places_block": "grass" },
  { "id": 3, "name": "stone", "display_name": "Stone", "max_stack": 64, "places_block": "stone" },
  { "id": 4, "name": "cobblestone", "display_name": "Cobblestone", "max_stack": 64, "places_block": "cobblestone" },
  { "id": 5, "name": "sand", "display_name": "Sand", "max_stack": 64, "places_block": "sand" },
  { "id": 6, "name": "gravel", "display_name": "Gravel", "max_stack": 64, "places_block": "gravel" },
  { "id": 7, "name": "snow_layer", "display_name": "Snow", "max_stack": 64, "places_block": "snow_layer" },
  { "id": 8, "name": "ice", "display_name": "Ice", "max_stack": 64, "places_block": "ice" },
  { "id": 9, "name": "clay", "display_name": "Clay Block", "max_stack": 64, "places_block": "clay" },
  { "id": 10, "name": "dim_stone", "display_name": "Dim Stone", "max_stack": 64, "places_block": "dim_stone" },
  { "id": 11, "name": "dim_dirt", "display_name": "Dim Dirt", "max_stack": 64, "places_block": "dim_dirt" },
  { "id": 12, "name": "oak_log", "display_name": "Oak Log", "max_stack": 64, "places_block": "oak_log" },
  { "id": 13, "name": "oak_planks", "display_name": "Oak Planks", "max_stack": 64, "places_block": "oak_planks" },
  { "id": 14, "name": "birch_log", "display_name": "Birch Log", "max_stack": 64, "places_block": "birch_log" },
  { "id": 15, "name": "birch_planks", "display_name": "Birch Planks", "max_stack": 64, "places_block": "birch_planks" },
  { "id": 16, "name": "stone_brick", "display_name": "Stone Brick", "max_stack": 64, "places_block": "stone_brick" },
  { "id": 17, "name": "clay_brick", "display_name": "Clay Brick", "max_stack": 64, "places_block": "clay_brick" },
  { "id": 18, "name": "glass_pane", "display_name": "Glass", "max_stack": 64, "places_block": "glass_pane" },
  { "id": 19, "name": "colored_glass", "display_name": "Colored Glass", "max_stack": 64, "places_block": "colored_glass" },
  { "id": 20, "name": "wool_block", "display_name": "Wool Block", "max_stack": 64, "places_block": "wool_block" },
  { "id": 21, "name": "mossy_stone", "display_name": "Mossy Stone", "max_stack": 64, "places_block": "mossy_stone" },
  { "id": 22, "name": "crafting_table", "display_name": "Crafting Table", "max_stack": 1, "places_block": "crafting_table" },
  { "id": 23, "name": "chest", "display_name": "Chest", "max_stack": 1, "places_block": "chest" },
  { "id": 24, "name": "torch", "display_name": "Torch", "max_stack": 64, "places_block": "torch" },
  { "id": 25, "name": "oak_door", "display_name": "Oak Door", "max_stack": 16, "places_block": "oak_door" },
  { "id": 26, "name": "beacon_block", "display_name": "Beacon", "max_stack": 1, "places_block": "beacon_block" },
  { "id": 27, "name": "glow_block", "display_name": "Glow Block", "max_stack": 64, "places_block": "glow_block" },
  { "id": 28, "name": "crystal_lamp", "display_name": "Crystal Lamp", "max_stack": 16, "places_block": "crystal_lamp" },
  { "id": 29, "name": "flower_red", "display_name": "Red Flower", "max_stack": 64, "places_block": "flower_red" },
  { "id": 30, "name": "flower_yellow", "display_name": "Yellow Flower", "max_stack": 64, "places_block": "flower_yellow" },
  { "id": 31, "name": "color_crystal", "display_name": "Color Crystal Block", "max_stack": 64, "places_block": "color_crystal" }
]
